{
  "subject": "P-7F3K9Q.T2",
  "binding": {
    "recorded": {
      "commit": "3f1c2e9bbe37e64d9b279c5e82fb04be3f2be493",
      "tree": "3a667d1ef542cd295daa1525a52a2c9767ed0577"
    },
    "match": {
      "source_tree": "118de8d98586904775030234fcde390dceb239fb6628c977611f7b27608ab964",
      "workorder_hash": "55ad984f61c749efcdcf5c777de2b6da3ab2c060d254e14220810edae286e5bd",
      "contract_hash": "e90e8774ddb2fd72a1ba81b6149dd88cf5a721460a1ab3b0afd09be0cde09bea",
      "charter_version": "1.0.0",
      "env_fp": "ebe6d6e28cde342ee2e6efe0693d8ec1413de6ec3a10830ca27c8bfa4c4f73c0"
    }
  },
  "taken_at": "2026-09-22T09:49:30Z",
  "checkout": "detached-sparse",
  "runner": {
    "keel_version": "0.3.0",
    "os": "win32",
    "node": "22.13.1"
  },
  "commands": [
    {
      "command": {
        "argv": [
          "npm",
          "test"
        ],
        "junit": "reports/junit.xml",
        "timeout_seconds": 600
      },
      "exit_code": 0,
      "status": "pass",
      "duration_ms": 8412,
      "stdout_sha256": "21d0b0d82aba9432023fbd90169a08f16188cf373318c3c2e94c354f171e22d3",
      "stderr_sha256": "f024c23098c80eaddfd6a17e7ff96ec998676b06a10e1ff94b4e24a31b03c8a5"
    }
  ],
  "rows": [
    {
      "name": "addTag stores a trimmed lowercase tag [R-notes-4QX7B#S1]",
      "scenarios": [
        "R-notes-4QX7B#S1"
      ],
      "status": "passed"
    },
    {
      "name": "addTag keeps one copy of a tag typed in another case [R-notes-4QX7B#S2]",
      "scenarios": [
        "R-notes-4QX7B#S2"
      ],
      "status": "passed"
    }
  ],
  "acceptance": [
    {
      "acc": "P-7F3K9Q#ACC-01",
      "evidence_mode": "test",
      "status": "pass",
      "passed": 1,
      "total": 1
    },
    {
      "acc": "P-7F3K9Q#ACC-02",
      "evidence_mode": "test",
      "status": "pass",
      "passed": 1,
      "total": 1
    }
  ],
  "not_run": [],
  "red_green": {
    "base": "2bdb45a16a391385f43f15d156b93184934a4a58",
    "change": "3f1c2e9bbe37e64d9b279c5e82fb04be3f2be493",
    "cited": [
      "R-notes-4QX7B#S1",
      "R-notes-4QX7B#S2"
    ],
    "red_at_base": true,
    "green_at_change": true,
    "status": "pass"
  }
}
